country,description,designation,points,price,province,region_1,region_2,variety,winery
US,"This tremendous 100% varietal wine hails from Oakville and was aged over three years in oak. Juicy red-cherry fruit and a compelling hint of caramel greet the palate, framed by elegant, fine tannins and a subtle minty tone in the background. Balanced and rewarding from start to finish, it has years ahead of it to develop further nuance. Enjoy 2022–2030.",Martha's Vineyard,96,235.0,California,Napa Valley,Napa,Cabernet Sauvignon,Heitz
US,"This spent 20 months in 30% new French oak, and incorporates fruit from Ponzi's Aurora, Abetina and Madrona vineyards, among others. Aromatic, dense and toasty, it deftly blends aromas and flavors of toast, cigar box, blackberry, black cherry, coffee and graphite. Tannins are polished to a fine sheen, and frame a finish loaded with dark chocolate and espresso. Drink now through 2032.",Reserve,96,65.0,Oregon,Willamette Valley,Willamette Valley,Pinot Noir,Ponzi
US,"This re-named vineyard was formerly bottled as deLancellotti. You'll find striking minerality underscoring chunky black fruits. Accents of citrus and graphite comingle, with exceptional midpalate concentration. This is a wine to cellar, though it is already quite enjoyable. Drink now through 2030.",Silice,95,65.0,Oregon,Chehalem Mountains,Willamette Valley,Pinot Noir,Bergström
US,"The producer sources from two blocks of the vineyard for this wine—one at a high elevation, which contributes bright acidity. Crunchy cranberry, pomegranate and orange peel flavors surround silky, succulent layers of texture that present as fleshy fruit. That delicately lush flavor has considerable length.",Gap's Crown Vineyard,95,60.0,California,Sonoma Coast,Sonoma,Pinot Noir,Blue Farm
US,"From 18-year-old vines, this supple well-balanced effort blends flavors of mocha, cherry, vanilla and breakfast tea. Superbly integrated and delicious even at this early stage, this wine seems destined for a long and savory cellar life. Drink now through 2028.",Estate Vineyard Wadensvil Block,95,48.0,Oregon,Ribbon Ridge,Willamette Valley,Pinot Noir,Patricia Green Cellars
US,"A standout even in this terrific lineup of 2015 releases from Patricia Green, the Weber opens with a burst of cola and tobacco scents and accents. It continues, subtle and detailed, with flavors of oranges, vanilla, tea and milk chocolate discreetly threaded through ripe blackberry fruit.",Weber Vineyard,95,48.0,Oregon,Dundee Hills,Willamette Valley,Pinot Noir,Patricia Green Cellars
US,"With its sophisticated mix of mineral, acid and tart fruits, this seductive effort pleases from start to finish. Supple and dense, it's got strawberry, blueberry, plum and black cherry, a touch of chocolate, and that underlying streak of mineral. All these elements are in good proportion and finish with an appealing silky texture. It's delicious already, but give it another decade for full enjoyment. Drink now through 2028.",Grace Vineyard,95,185.0,Oregon,Dundee Hills,Willamette Valley,Pinot Noir,Domaine Serene
US,"First made in 2006, this succulent luscious Chardonnay is all about minerality. It's got a rich core of butterscotch and the seemingly endless layers of subtle flavors that biodynamic farming can bring. It spends 18 months on the lees prior to bottling. Drink now through 2028.",Sigrid,95,90.0,Oregon,Willamette Valley,Willamette Valley,Chardonnay,Bergström
US,"This blockbuster, powerhouse of a wine suggests blueberry pie and chocolate as it opens in the glass. On the palate, it's smooth and seductively silky, offering complex cedar, peppercorn and peppery oak seasonings amidst its dense richness. It finishes with finesse and spice.",Rainin Vineyard,95,325.0,California,Diamond Mountain District,Napa,Cabernet Sauvignon,Hall
US,"This fresh and lively medium-bodied wine is beautifully crafted, with cherry blossom aromas and tangy acidity. Layered and seductive, it offers a crisp mix of orange peel, cherry, pomegranate and baking spice flavors that are ready for the table or the cellar.",Gap's Crown Vineyard,95,75.0,California,Sonoma Coast,Sonoma,Pinot Noir,Gary Farrell
US,"The apogee of this ambitious winery's white wine efforts, this bottling of just two barrels of Clone 5 shows focused marzipan, marcona almond and white peach notes on the nose. The palate sizzles with saltiness and a lemony acidity that cuts through its brown butter richness with finesse. The finish is luxurious and long.",Giallo Solare,95,60.0,California,Edna Valley,Central Coast,Chardonnay,Center of Effort
US,"San Jose-based producer Adam Comartin heads 1,100 feet up into the mountains to source fruit for this tremendous wine, which offers wild cherry, sage, and eucalyptus scents on the nose. Ripe black plum and strawberry fruit lead the palate, followed by acid-driven waves of juniper, pine and bay leaf, finishing with a menthol-like sensation.",R-Bar-R Ranch,95,45.0,California,Santa Cruz Mountains,Central Coast,Pinot Noir,Comartin
New Zealand,"Yields were down in 2015, but intensity is up, giving this medium-bodied, silky wine the potential to drink well through at least 2025. Hickory smoke outlines white peach before ending in a long flurry of lime zest.",Maté's Vineyard,94,57.0,Kumeu,,,Chardonnay,Kumeu River
US,"Bergström has made a Shea designate since 2003, intent on showcasing a “pretty” style of the vineyard. Here are lovely aromatics, with grape jelly, rose petals and plum in the nose, and a complex run of red fruits in the mouth. Streaks of cola, brown sugar and more come up in a generous finish.",Shea Vineyard,94,62.0,Oregon,Willamette Valley,,Pinot Noir,Bergström
US,"Focused and dense, this intense wine captures the essence of ripe raspberries. Aged in 50% new French oak, it's got a strong vein of coffee and mocha. The flavors broaden out and penetrate, finishing with highlights of cedar, cinnamon and dark chocolate. Drink now through the 2020s, but decant if you want the full expression.",Abetina,94,105.0,Oregon,Willamette Valley,Willamette Valley,Pinot Noir,Ponzi
US,"Cranberry, baked rhubarb, anise and crushed slate aromas show on the nose of this always-excellent bottling from the Franscioni family. The palate abounds with energy, driving black raspberry fruit accented with earthy loam, fennel, oregano and juniper through a compellingly round midpalate.",Garys' Vineyard,94,60.0,California,Santa Lucia Highlands,Central Coast,Pinot Noir,Roar
US,"Steely and perfumed, this wine sees only 20% new French oak, remaining vibrantly fresh. Baked apple and lemon pith veer into grapefruit on the palate, with spiciness to the finish that's both brash and loud.",Babushka,90,37.0,California,Russian River Valley,Sonoma,Chardonnay,Zepaltas
US,"The aromas entice with notes of wet stone, honeysuckle, chamomile and stone fruit. The palate is generous in flavor and feel, showing a fine sense of balance.",Conner Lee Vineyard,90,42.0,Washington,Columbia Valley (WA),Columbia Valley,Chardonnay,Buty
Italy,"This bright, savory wine delivers aromas and flavors of juicy wild cherry, black raspberry, violet, white pepper and mocha. Polished tannins provide the framework. Enjoy through 2020.",Riserva,90,29.0,Tuscany,Chianti Classico,,Red Blend,Castello di Monterinaldi
Italy,"Aromas of dark-skinned berry, rose and wild herb lead the nose. The round, juicy palate doles out ripe black cherry, fleshy raspberry, white pepper and clove while polished tannins provide a smooth, velvety framework. Enjoy through 2019.",Riserva,90,39.0,Tuscany,Chianti Classico,,Red Blend,Rignana
Italy,"A blend of 90% Sangiovese and 10% Canaiolo, this opens with aromas of violet, mature plum, espresso and a whiff of forest floor. The firm palate offers dried black cherry, ground pepper, toast and clove while packed, fine-grained tannins provide support. Drink through 2020.",Vigneto Odoardo Beccari Riserva,90,30.0,Tuscany,Chianti Classico,,Red Blend,Vignavecchia
US,"Blended with 9% Malbec, 9% Cabernet Franc and 5% Petit Verdot, this is a perennial classic for the winery, the sister brand of Cuvaison. Juicy in cherry and cassis, it sustains big, pillowy tannins and tar, suggesting more time for the fruit to match up with the structure. Drink through 2020.",Estate Grown,90,60.0,California,Mount Veeder,Napa,Cabernet Sauvignon,Brandlin
US,"The aromas of blue fruit, herbs and spice are initially under tight restraint. The flavors are full, with the tannins simultaneously firm and fine grained. It shows good length.",,90,40.0,Washington,Red Mountain,Columbia Valley,Cabernet Sauvignon,Canvasback
France,"This structured, complex Chardonnay is packed with minerality and considerable weight. The tight texture and almost tannic character will soften over the next few months. Full of potential, it's drinkable now but will be so much better from 2017.",,90,68.0,Burgundy,Chassagne-Montrachet,,Chardonnay,Chartron et Trébuchet
France,"With its light color and cool feel, this well-balanced wine comes from a parcel of 30-year-old vines. The smoky tannins and intense acidity give a wine that will develop well and slowly. It's still young with its red-berry fruits and fresh aftertaste. Drink from 2018.",L'Inédit,90,28.0,Loire Valley,Coteaux du Giennois,,Pinot Noir,Clement et Florian Berthier
US,"There's a lot to like in this nicely priced white, a blend of several regional vineyards. A taste of hazelnut expands on the palate to meet creamy Tahitian vanilla. Approachably round, this crowd-pleasing wine finishes in measured, integrated oak.",,90,18.0,California,Russian River Valley,Sonoma,Chardonnay,De Loach
US,"A blend of Cabernet from Grand Ciel (31%), Ciel du Cheval (30%), Upchurch (28%) and Klipsun (11%) vineyards, wood spice aromas start out up front. The cherry flavors are light and elegant, with the tannins bringing some grip.",Four Flags,90,69.0,Washington,Red Mountain,Columbia Valley,Cabernet Sauvignon,DeLille
Italy,"This savory blend of 40% Merlot, 30% Cabernet Sauvignon, 25% Cabernet Franc and 5% Syrah opens with aromas of roasted coffee bean, leather, tobacco and dark woodland berry. The chewy palate offers juicy plum, cassis and clove alongside polished tannins. Drink through 2019.",Poggio Bestiale,90,60.0,Tuscany,Maremma Toscana,,Red Blend,Fattoria di Magliano
Australia,"Moorooduc's estate Pinot Noir is a solid value among the boutique offerings from the Mornington Peninsula. There's a supple cushioning of flesh wrapped around a firm backbone of acid, while the flavors run from black cherry and mint through earthier notes of brown sugar and roasted parsnip. Drink now through 2020.",,91,36.0,Victoria,Mornington Peninsula,,Pinot Noir,Moorooduc
France,"L'Homme Mort is a northern extension of the Fourchaume Premier Cru vineyard, so called because this was where a local lord dispensed justice by death. It often produces cooler wines such as this. It is tight, with toasted bread hints and with a strongly tangy character. It does need to develop and shouldn't be drunk before 2018.",L'Homme Mort Premier Cru,91,45.0,Burgundy,Chablis,,Chardonnay,Domaine Chenevières
France,"The steely character of a young Chablis is very apparent in this wine. It is crisp, lemon flavored and with a mineral edge. The wine has a juicy freshness, still young at heart and needing to age. Drink from 2018.",Fourchaume Premier Cru,91,38.0,Burgundy,Chablis,,Chardonnay,Louis Max
US,"From the producer's monumental Atlas Peak vineyard, this is a tightly wound, solidly constructed mountain Cab, blended with a handful of Petit Verdot. Tobacco, black tea and a sliver of coconut intermingle around a medium-bodied whole that will benefit from cellaring, through 2021.",Animo,91,85.0,California,Napa Valley,Napa,Cabernet Sauvignon,Michael Mondavi Family Estate
US,"Big, bold, dark and chewy, this builds upon substantial black-cherry fruit and supporting acids. Still knitting together, it shows highlights of cedar and tobacco, along with thick tannins. Give this a couple more years of bottle age, and drink after 2018.",Schindler Vineyard,91,50.0,Oregon,Eola-Amity Hills,Willamette Valley,Pinot Noir,Panther Creek
US,"A juiciness of cherry and vanilla spark the opening of this wine, a celebration of the vintage, appellation and in this case, fruit-forwardness of the variety. With a backbone of oak and cedar, it has smooth tannins and medium weight, finishing in mocha chocolate. Drink now through 2022.",Barrel Select,91,60.0,California,Rutherford,Napa,Cabernet Sauvignon,Provenance Vineyards
US,"Sweetened tannins highlight a depth of chocolate and blackberry in this 100% varietal wine made in small amounts. Soft and juicy, it crafts a balance of richness and density around elegant spicy clove and cinnamon.",District Collection,91,85.0,California,St. Helena,Napa,Cabernet Sauvignon,Raymond
US,"This wine draws from a handful of tremendous vineyard sites, including the producer's estate, Platt and Clary Ranch, all cool-climate and windswept. It's a tight, light and minimally messed-with wine, bright in cherry, pomegranate and rose.",,91,45.0,California,Sonoma Coast,Sonoma,Pinot Noir,Red Car
US,"An elegant blend from different estate vineyards, this widely available cuvée brings sturdy tannins and red currant fruit, highlighted with pretty baking spices. It would be an ideal match for roast duck with an orange sauce.",Premier Cuvée,91,54.0,Oregon,Willamette Valley,Willamette Valley,Pinot Noir,Archery Summit
France,"This wine is bone-dry, although with some age the shock of the acidity has been rounded out by a hint of toast. It's linear, fresh and intensely crisp, with citrus and almond tones. Drink this wine from a good vintage now.",Le Nombre d'Or Brut Nature,91,85.0,Champagne,Champagne,,Chardonnay,Aubry
US,"This wine over-delivers in quality for the price. It's made from mostly Cabernet Sauvignon, with handfuls of Merlot, Malbec, Petit Verdot and Cabernet Franc blended in to good effect. The whole combines into layers of chocolate and graham cracker, dappled in vanilla and jam. Thick tannins suggest a swirl or two of the glass. The finish is all tobacco.",,91,28.0,California,Napa Valley,Napa,Cabernet Sauvignon,B Side
US,"Generous black-cherry fruit anchors this barrel-aged wine that remains tartly acidic, with pretty accents of toast and mocha. Focused, young and fresh, it should drink optimally 2018–2028.",Aeolian,91,42.0,Oregon,Eola-Amity Hills,Willamette Valley,Pinot Noir,Bethel Heights
Israel,"Dark red violet in color, this wine has aromas of cherry, lavender and rose petal. It is a well-balanced wine with flavors of black cherry, raspberry, Turkish delight and herbes de Provence. Silky tannins coat the palate into the lasting finish, which is punctuated by a note of bright cherry.",Reserve,91,25.0,Upper Galilee,,,Cabernet Sauvignon,Binyamina
France,"This delicious, refreshing wine is textured, tight and mineral, with fruity acidity. Tangy and crisp, it has a tight structure, touches of toast along with apple and citrus flavors. The wine is still young and very tight, so should not be drunk before 2017.",Montmains Premier Cru,91,45.0,Burgundy,Chablis,,Chardonnay,Domaine Gérard Duplessis
US,"From a multiplicity of vineyards, this wine works and is a tremendous value for the price. It mixes hot mulled-cider spices, cinnamon, clove and pine forest, conveying surprising depth. Plum, dark cherry and more clove lead to a powerful, leathery finish.",,91,22.0,California,Napa Valley,Napa,Cabernet Sauvignon,Eagle Glen
US,"The first Pinot Noir release from this producer, this is a velvety-smooth, exotic and charming wine, light on the palate despite a concentration of ripe, rich fruit. Kirsch, cherry, raspberry and cinnamon combine to make the wine invitingly lush and plush.",Bacigalupi Vineyard,91,65.0,California,Russian River Valley,Sonoma,Pinot Noir,Eleven Eleven
US,"Bright, light oak shadings dress up this medium-bodied wine, complementing the red cherry and strawberry flavors. It's fresh, fruity and not very tannic—easy to drink and enjoy.",,86,10.0,California,California,California Other,Cabernet Sauvignon,Belle Ambiance
US,"A smoky scent and earthy, crisp-apple flavors make this medium-bodied wine a change of pace from the average butterball Chardonnay. It has welcome acidity and a nicely smooth texture.",Small Lot Blend,86,13.0,California,Mendocino County,Mendocino/Lake Counties,Chardonnay,Parducci
US,"This is an easygoing wine that's neither too oaky nor too crisp, with a decent blend of ripe pear and baking spice flavors paired with soft, smooth texture.",,86,18.0,California,California,California Other,Chardonnay,The Naked Grape
US,"Blended with small amounts of Merlot, Cabernet Franc, Petit Verdot and Malbec, this is an austere, unfussy red made in modest quantities that has crisp red currant and cranberry flavors interwoven with cedar and dried herb.",,86,36.0,California,Sonoma Valley,Sonoma,Cabernet Sauvignon,Tin Barn
US,"Brambly and herbal, this wine shows bright acidity underlying a full-bodied, incoherently ripe palate of tar, toffee and rich cola notes.",Stephanie,86,50.0,California,Napa Valley,Napa,Cabernet Sauvignon,Hestan
US,"This medium-bodied wine has more earthy and floral flavors than straightforward fruit, so it's something a bit different. Well-priced and easy to drink, it can please a crowd.",,86,10.0,California,California,California Other,Chardonnay,Leaping Horse
US,"This is from a hillside estate vineyard and is entirely barrel fermented, its oak subtle and supportive. Medium bodied and not overripe, it offers honeysuckle aromas and lime and lemon rind flavors.",Homestead Block,86,45.0,California,Napa Valley,Napa,Chardonnay,Kuleto Estate
US,"This mountain-grown wine is hugely tannic and oaky, hard to penetrate in its full-bodied ripeness. Smoky oak and currant flavors vie for attention against a backdrop of concentration and power.",Limited Release Cold Springs Vineyard,86,125.0,California,Howell Mountain,Napa,Cabernet Sauvignon,Charles Krug
US,"Let this burly, big-boned beauty open to fully enjoy its robust oak and fistfuls of black cherry, the oak showing in terms of toasty, slightly reductive aromas. A smooth texture keeps the wine flowing along a concentrated highway of power and ripeness.",The Flyer,91,59.0,California,Russian River Valley,Sonoma,Pinot Noir,MacPhail
US,"This small-quantity selection from within the Charles Vineyard was fermented by native yeast, and neither fined nor filtered. It is quite aromatic, full bodied and moderately fruity, and has a nice rounded mouthfeel, generous red-cherry and spice flavors and good structure from acidity and mild tannins. Tart cherry lingers on the finish.",Charles Vineyard Clone 05,91,49.0,California,Anderson Valley,Mendocino/Lake Counties,Pinot Noir,Foursight
US,"This wine takes time to unravel and reveal itself, rewarding the patient with a wealth of high-toned citrus and elegantly wound, medium-bodied honeyed pear and caramel. Lengthy and complex, it's one to consider aging and allowing to further mellow over time. Drink now through 2021.",Paris Tasting Commemorative,91,93.0,California,Napa Valley,Napa,Chardonnay,Grgich Hills
US,"This wine is tasty, tangy and nervy, bringing a very refreshing and appetizing mouthfeel, and wonderful fresh acidity. All of that tang shows good fruitiness too, as the red-cherry and cranberry flavors are vivid and concentrated. It's a versatile wine to drink now or buy by the case to save some bottles for more aging.",Methode a l'Ancienne,91,32.0,California,Anderson Valley,Mendocino/Lake Counties,Pinot Noir,Navarro
US,"This medium-bodied wine has a compelling blend of restraint and power. It offers modest, fruity aromas at first, then nice tart fruit flavors that start off lean and soon expand exponentially in the mouth before tapering off elegantly on the finish. With little oak flavor in the way, it gives pure Pinot sophistication.",,91,20.0,California,Anderson Valley,Mendocino/Lake Counties,Pinot Noir,Navarro
US,"This is a thick, chocolatey wine with a side of leather and black pepper that appeals on multiple levels. Full-bodied concentration gives way to a smooth, rounded palate robust in blackberry and vanilla.",Central Park West Vineyard,90,50.0,California,St. Helena,Napa,Cabernet Sauvignon,Trinchero
US,"Fairly light in the glass, this bottling shows chalk, slate and wet-sand minerality on the nose, alongside Asian pear flesh, kiwi and honeydew fruit notes. The texture is quite pithy once sipped, showing grapefruit and apple skins, and then it warms toward yellow pears and a sea salt warmth.",,90,45.0,California,Santa Lucia Highlands,Central Coast,Chardonnay,Alexander-Smith
US,"This is a delightfully crisp, elegant and lip-smacking wine, that's subtle and easy to love. Lemon peel, apple skin and pear play together well, never becoming distracting, but instead integrating well with one another and the light hint of oak. Food friendly, it's also a great deal.",,90,16.0,California,Sonoma County,Sonoma,Chardonnay,Benziger
US,"While Cabernet Sauvignon dominant, all five red Bordeaux varieties are represented here. Dark in color, a combination of black pepper and black-fruit syrup meets earthy and dry tannins. This structured wine needs time. Cellar through 2020.",Longwood,90,30.0,California,Napa Valley,Napa,Cabernet Sauvignon,Beaucanon
US,"Estate grown and aged in Stainless steel, this racy and pungent wine is packed with rich, juicy fruit flavors. Apple, lemon-lime and tangerine are in the mix, showing that Chardonnay does not always need oak flavors to have real power.",,90,26.0,Oregon,Applegate Valley,Southern Oregon,Chardonnay,Schmidt
US,"Red-cherry and strawberry aromas meld with rich fruit and warm baking-spice flavors to make this full-bodied wine hard to resist. The style is in the ripe, pastry shop mode, and soft tannins and acidity complete the picture.",,90,55.0,California,Anderson Valley,Mendocino/Lake Counties,Pinot Noir,Goldeneye
US,"Reflecting the vintage, this Pinot is light and lithe in style. It shows tart cherry fruit and suggestions of chocolate, with bright acidity and a thin finish.",,89,50.0,Oregon,Willamette Valley,Willamette Valley,Pinot Noir,Bomb
France,"This well-balanced, fruity wine allows space for some solid dry tannins that also show wood aging. Berry fruits shine through the structure to give a juicy character that is underlined by the fresh acidity at the end.",,89,20.0,Southwest France,Cahors,,Bordeaux-style Red Blend,Chateau Quattre
Chile,"Staunch berry, cassis and spice aromas are friendly and congruent. This Malbec-led blend is jammy in feel, a bit hollow in the middle, and easy to like as a whole. Blackberry and blueberry flavors finish fleshy, with soft tannins.",Fina Reserva Ensamblaje Malbec-Cabernet Sauvignon-Syrah,89,19.0,Colchagua Valley,,,Red Blend,Estampa
US,"Winemaker Billy Wathen blends 60% Merlot and 40% Cabernet Franc into this blend that's named after the U.S. Geologic Survey's name for Happy Canyon. A nose of dried oregano and thyme has a Bing cherry backdrop, with a palate of green peppers, blackberries and tomato leaf.",Range 30 West,89,42.0,California,Happy Canyon of Santa Barbara,Central Coast,Bordeaux-style Red Blend,Foxen 7200
US,"A blend of fruit from three Rogue Valley sites, this is a fine example of the style of Pinot made in Southern Oregon. The estate vineyard sits at 2,100 feet on a steep, east-facing slope, with densely planted vines. It's a big, blocky, full-bodied wine, loaded with flavors of black cherry, black coffee and barrel toast. Tannins are substantial, but the flavors are full and forward. What it lacks in elegance it makes up for in immediate likeability.",,89,35.0,Oregon,Oregon,Oregon Other,Pinot Noir,Irvine Family Vineyards
US,"Tightly focused, as is often true of single-vineyard bottlings, this matches spicy berry fruit to light barrel flavors of milk chocolate. It's smooth and accessible, but finishes a bit short.",Freedom Hill Vineyard,89,36.0,Oregon,Willamette Valley,Willamette Valley,Pinot Noir,Silvan Ridge
Italy,"Crushed plum, espresso, tobacco and cedar aromas unfold in the glass. A blend of 90% Merlot and 10% Alicante, the straightforward palate offers blackberries, red currants, clove and licorice alongside fine-grained tannins.",Le Redini,89,25.0,Tuscany,Toscana,,Red Blend,Tenuta degli Dei
Italy,"Aromas of wild berries, violets and a whiff of spice lead the nose on this blend of Sangiovese and 15% Merlot. The savory, easygoing palate offers mature black cherry, clove and black pepper alongside lithe tannins. Drink through 2016.",Il Guardiano,89,22.0,Tuscany,Toscana,,Red Blend,Poggio Mandorlo
US,"This has a light yellow color with a touch of green and a subtle smell of crisp green apples. Flavors that are richer than expected, like poached pears, butter and fig. The texture is rich, the body full and the ripe flavors linger on the finish.",Del Arroyo Vineyard,89,25.0,California,Livermore Valley,Central Coast,Chardonnay,Occasio
US,"Rhubarb, cola and pencil shavings emerge from the glass on this appellation blend from the longtime Santa Rosa Road winery, today owned by the Terlato family. Deeply earthy aromas of beet juice, root beer and dried berries arise on the palate, showing the region's typical blend of soil minerality and dark fruit.",,89,42.0,California,Sta. Rita Hills,Central Coast,Pinot Noir,Sanford
US,"Made from what Californians call the Pommard clone, this has a light, traditional garnet color. Fresh and lively fruit aromas resemble cranberries and red cherries, followed by tangy fruit and cinnamon flavors of medium intensity, supported by firm acidity and moderate tannins.",Charles Vineyard Clone O5,89,49.0,California,Anderson Valley,Mendocino/Lake Counties,Pinot Noir,Foursight
