country,description,designation,points,price,province,region_1,region_2,variety,winery
US,"Firm and focused, this lightly spiced effort supports its tart cherry fruit with ample acidity. Hints of toasted coconut build in the finish. A few more years of bottle age should bring further integration.",Nuthouse Lone Star Vineyard,90,50.0,Oregon,Eola-Amity Hills,Willamette Valley,Pinot Noir,Argyle
Israel,"A nose of wild blackberry and brambles lays the groundwork for a tender dance of fruit and herbal flavors, especially blackberry, pomegranate, eucalyptus and fennel bulb. Mouth-coating tannins dissipate on the finish, joined by a burst of tart pomegranate.",Kayoumi Single Vineyard,90,40.0,Galilee,,,Cabernet Sauvignon,Carmel
France,"An impressive blend of Merlot and Malbec, this is a solid, dark wine packed with both tannins and ripe berry fruits. It has a serious character with toast, acidity and complex spice flavors. Drink from 2018.",Comtesse de Ségur,90,19.0,Southwest France,Montravel,,Bordeaux-style Red Blend,Château Laulerie
US,"At David Hill, the Winemakers Cuvée is a cut above the reserve. It's a muscular blend of scents and flavors of lavender, cherry and chocolate wrapped into a firm, focused finish.",Winemakers Cuvée,90,50.0,Oregon,Willamette Valley,Willamette Valley,Pinot Noir,David Hill
US,"Waxy apple stars in this brisk, approachable white from a single estate-farmed block, the oak briny and salty in toast and honey. Textured and elegantly light bodied, it finishes with a satisfying note of lemon candy.",DCV Estate Block 10,90,30.0,California,Russian River Valley,Sonoma,Chardonnay,Dry Creek Vineyard
US,"A blend of 85% Cabernet Sauvignon with 15% Merlot, this was built to be approachable young. Grapes are sourced from an estate, organically farmed vineyard as well as two neighboring properties, Pickberry and Murray Ranch. Tobacco forms around a juiciness of blackberry and raspberry, giving it a sultry edge, while maintaing soft tannins throughout.",Counterpoint,90,40.0,California,Sonoma Mountain,Sonoma,Cabernet Sauvignon,Laurel Glen
US,"Sourced from the southeastern section of the Rutherford appellation and 100% varietal, this is a seamlessly made wine, luxurious in cherry pie and leather saddle. Tangy acidity meets the dusty tannins head-on, finishing with a burst of orange zest.",,90,100.0,California,Napa Valley,Napa,Cabernet Sauvignon,Mathew Bruno
US,"This stellar reserve remains one of the finest Chardonnays from Oregon. Meyer lemon, peanut oil, salted nuts, citrus and tangerine combine in a deep and intense palate. Whole-cluster pressed and barrel fermented (but in just 10% new French oak), this delicious, dense and penetrating wine should be consumed now through the early 2020s.",Reserve,93,40.0,Oregon,Willamette Valley,Willamette Valley,Chardonnay,Ponzi
New Zealand,"The most recent of Palliser's Great Dog releases, the 2014 Ted is a full-bodied, muscular wine. Cola, cinnamon and thyme notes mark the nose, while the flavors feature dark cherries and plums, drawing to a lingering close with echoes of mocha and Mexican chocolate. Drink 2020–2028.",The Great Ted,92,63.0,Martinborough,,,Pinot Noir,Palliser Estate
US,"Wreaths of smoke surround pretty raspberry aromatics. The red and plummy purple-fruit flavors continue, along with some tannic muscle and grip. This is a mix of 667 and Pommard clones—still young and a bit tight.",Côte Sud Vineyard,92,75.0,Oregon,Dundee Hills,Willamette Valley,Pinot Noir,Domaine Serene
US,"This was the first winery to make a truly white Pinot Noir (back in 2004). Produced exclusively from Pommard clones, it's barrel fermented and aged much like a Chardonnay. Along with great texture and length, there's plenty of acid supporting its palate-pleasing mix of white peach, melon and gooseberry. It finishes with a thread of lightly buttery caramel.",Coeur Blanc (White Heart),92,95.0,Oregon,Willamette Valley,Willamette Valley,Pinot Noir,Domaine Serene
US,"Like many of the winery's bottlings, this wine shows rich but balanced concentration. Loamy and fulfilling baked blueberry and blackberry aromas are laced with vanilla. The palate is lavish as well, with strong blueberry syrup, herb and pepper flavors and a caramel touch on the finish.",Lock Vineyard,92,42.0,California,Paso Robles,Central Coast,Cabernet Sauvignon,Écluse
US,"This new offering, made by Ross Cobb and Katy Wilson, is intended as a “best of the west.” Sourced from several vineyards, it reveals true coastal qualities, with ethereal earthiness and an Old World sensibility. Cloudy in the glass, it shows cranberry, orange, bay leaf and tea flavors as it unwinds.",Westlands,92,54.0,California,Sonoma Coast,Sonoma,Pinot Noir,Anaba
US,"Bryan Babcock makes plenty of more expensive Pinot Noirs, but this appellation blend hits all the right notes and shows off the results of the “pedestular cane suspension” technique he's been using in the vineyard. Wild thyme, sagebrush and bay leaf meet cranberry and slate aromas on the nose. Black raspberry and cranberry flavors lead the earthy palate, accented with nettle and peppercorn.",,92,35.0,California,Sta. Rita Hills,Central Coast,Pinot Noir,Babcock
US,"In French, the vineyard name means “the meadow on the mountain,” a fitting name for the site. This is a spicy wine, with a touch of red-hot candy. The pretty cherry fruit is underscored with earth and mineral, and the astringent, tea-flavored tannins morph into a suggestion of cola at the tail end.",Le Pré du Col Vineyard,92,68.0,Oregon,Ribbon Ridge,Willamette Valley,Pinot Noir,Bergström
France,"The top wine from this estate is impressive. It has rich black fruits and firm tannins, showing its youthfulness. Its weight and concentration combine with the ripe fruits to give a wine that is destined for long-term aging. Négrette, Syrah and Cabernet Sauvignon go into this fine blend. Drink it from 2020.",Optimum,92,28.0,Southwest France,Fronton,,Red Blend,Château Bellevue la Forêt
US,"Though labeled Willamette Valley, this is single vineyard Chehalem Mountains AVA fruit. Smooth, ripe and buttery, from sniff to swallow, it's loaded with Satsuma orange, Meyer lemon and pink-grapefruit flavors. The acids snap and the finish lingers, with a streak of vanilla and a slight sensation of heat.",Avellana Vineyard,92,63.0,Oregon,Willamette Valley,Willamette Valley,Chardonnay,Ponzi
US,"The aromas of vanilla, herb and cherry show some volatility. The cherry flavors are light, finishing tart.",Cesar,85,26.0,Washington,Horse Heaven Hills,Columbia Valley,Bordeaux-style Red Blend,Martinez & Martinez
Argentina,"Floral berry and plum aromas are also saucy and oaky, and thus discordant. A wobbly tannic palate with green herbal oaky blueberry flavors tastes grassy on the finish. If you know Casarena's wines, this fits the mold.",505 Esencia,84,12.0,Mendoza Province,Mendoza,,Bordeaux-style Red Blend,Casarena
Spain,"Off the bat, this smells a bit like fruit punch, although with time it stiffens. A chunky heavy somewhat flat palate tastes of clove, chocolate and berry and plum.",Don Ramón,84,9.0,Northern Spain,Campo de Borja,,Red Blend,Bodegas Aragonesas
US,"Reduced and dominated by tannin and oak, this large production offering is earthy and spicy, with full-bodied texture and weight. It finishes slightly green.",,84,29.0,California,Los Carneros,Napa-Sonoma,Pinot Noir,Acacia
US,Jammy aromas and equally ripe sweet fruit flavors give this wine a candied character. It's full-bodied and feels a little warm on the finish.,,84,12.0,California,California,California Other,Pinot Noir,Sand Point
US,"Sourced entirely from the Otis Harlan Vineyard, these vines were planted about 25 years ago. It's a pleasure to see them singled out for this showcase bottling. It's a rich, oily, nutty, buttery style to be sure, but also dense with ripe apple, pear and peach fruit. The acidity buoys it up throughout a strong, long finish.",Dijon Clone,92,32.0,Washington,Yakima Valley,Columbia Valley,Chardonnay,Array
US,"The Daou brothers' considerable and continual investments is evidence that their wines will matter for years, ensuring a wise investment today. This 70% Cabernet Franc and 30% Merlot offers aromas of blueberry and cedar. Once sipped, the tannins grab with strength before dissipating smoothly. It's a seamless combo of spice, fruit, wood and herbs, but will evolve through at least 2025.",Seventeen Forty Reserve,92,56.0,California,Paso Robles,Central Coast,Bordeaux-style Red Blend,Daou
US,"A classic Napa Valley Chardonnay, this is smooth, rich, balanced and well composed. Flowery aromas of honeysuckle open the way for lemon curd and ripe apple to compete with a depth of crème brûlée character that provides plenty of complexity, with additional accents of honey and spice.",Cuvée Sauvage,91,40.0,California,Carneros,Napa-Sonoma,Chardonnay,Franciscan
US,"Kian Tavakoli is the winemaker for this small-production Cabernet Sauvignon with some Merlot, Petit Verdot and Cabernet Franc. A brambly, full-bodied wine, it's concentrated in black fruit with a spicy streak of clove.",,91,54.0,California,Napa Valley,Napa,Cabernet Sauvignon,Greyscale
Chile,"From a warm vintage, this blend is ripe yet still balanced, with aromas of prune, blackberry, tree bark and leather. The palate is saturated and broad, boasting flavors of dark, baked, black fruit accented by pepper and chocolate on the finish. Drink now.",Canto de Apalta Cellar Selection,91,22.0,Rapel Valley,,,Red Blend,Lapostolle
US,"Fully creamy and generous in crème brûlée and lemon curd, this dances in acidity and is balanced, the texture silky smooth. Highlights center on fresh-cut Anjou pear, a slice of which would go well with the wine, accompanied by Stilton.",,91,40.0,California,Russian River Valley,Sonoma,Chardonnay,Chasseur
US,"A sharp brine character gets warmer boosts from underlying pear, nectarine and buttered sourdough aromas. Flavors are light and bright at first, with sandy clay, vanilla cookie and custard strudel emerging on the midpalate and a line of acidity down through the finish.",,91,24.0,California,Edna Valley,Central Coast,Chardonnay,Talley
US,"Similar in style and aging potential to the winery's 2009, and blended with amounts of Malbec and Petit Verdot, this Cabernet Sauvignon from mighty Howell Mountain is rich in spicy blackberry and clove, the tannins soft and juicy.",,91,80.0,California,Howell Mountain,Napa,Cabernet Sauvignon,Prim Family
US,"A solid wine for the price, this begins with honeydew and lime aromas. Flavors start with a spicy cinnamon apple before diving into buttered squash, melon and fresh lime, with a dash of salt.",Estate,91,15.0,California,Paso Robles,Central Coast,Chardonnay,Castoro Cellars
US,The new American oak barrel fermentation and aging steals the show on this wine. Notes of vanilla and woodspice overpower the variety's melon and apple aromas and flavors. There are some good things going on but it's hard to get at them.,The Reserve,87,25.0,Washington,Horse Heaven Hills,Columbia Valley,Chardonnay,14 Hands
US,"Straightforward oak and roasted pear aromas great the nose on this wine from one of the region's central and historic vineyards. Flavors are a little flat at first, but then apple flesh and pear skin bitterness emerge, with citrusy acidity.",Reserve,87,35.0,California,Edna Valley,Central Coast,Chardonnay,Edna Valley Vineyard
Italy,"Underbrush, tobacco and spiced plum aromas lead the nose. On the straightforward palate, notes of anise and clove add depth to the black cherry core. It's easy drinking, with lithe tannins.",Emilio Primo,87,25.0,Tuscany,Bolgheri,,Red Blend,Terre del Marchesato
US,"This lightly aromatic wine offers notes of pear, peach and spice. It's straight down the fairway with appealing stone fruit flavors and a lightly creamy feel.",,87,15.0,Washington,Columbia Valley (WA),Columbia Valley,Chardonnay,Columbia Winery
US,"Made with 58% Malbec and 42% Syrah, this wine offers alluring aromas of thyme, dried herbs, raspberry and white pepper. It's elegant in style, supple in feel, providing a lot of easy-drinking pleasure.",Cutthroat Blend,87,35.0,Washington,Columbia Valley (WA),Columbia Valley,Red Blend,Flying Trout
France,"This is well-balanced and ripe, with plenty of room for both the attractive black fruits and the firm tannic structure. Wood aging shows, although it will integrate well. The wine is fruity, likely to be ready to drink from 2016.",Château Courbian,87,19.0,Bordeaux,Médoc,,Bordeaux-style Red Blend,Producta Vignobles
US,"A kitchen-sink blend of nine different varieties with Merlot (40%) and Syrah (25%) taking the lead, this wine brings an assortment of herbs, blue fruit and woodspice along with light volatile notes. It's full bodied and sweet with abundant cherry flavors backed by grainy tannins.",Sharp Sisters,87,26.0,Washington,Columbia Valley (WA),Columbia Valley,Red Blend,Mercer
US,"Crisp lemon, fennel and Bosc pear come into play in this medium-bodied Chardonnay, accented by a taste of fig. Taking on depth and breadth as it develops in the glass and on the palate, the wine finishes long and lean.",,87,20.0,California,Russian River Valley,Sonoma,Chardonnay,Taft Street
Italy,"Made from organically farmed grapes, this hearty blend of 90% Sangiovese and 10% Canaiolo opens with earthy aromas of violets, iris, mature black fruit and leather. The juicy, ripe palate delivers fleshy black cherry, truffle, tobacco, black pepper and mint alongside solid tannins. It has a meaty, rustic note but it's delicious. Alberello Imports, Ionia Atlantic Imports.",Riserva,90,25.0,Tuscany,Chianti Classico,,Red Blend,Fattoria La Ripa
US,"This is a bone-dry, tannic, acidic and tightly wound Cabernet, with a solid core of blackberry aromas and flavors. Stylistically, it plants its flag squarely in favor of elegance, it just needs a little more time to fully integrate.",Special Reserve,90,40.0,California,Napa Valley,Napa,Cabernet Sauvignon,Herzog
US,"The vineyard is in the Santa Maria Valley, and has been source for many years of great Pinots for multiple wineries lucky enough to obtain its fruit. The wines always show a similar profile of tannins, brisk acidity, a certain full-bodiedness and plenty of crushed brown spices. In this cool '11 vintage, the wine is particularly tart in cranberries and raspberries. Decant for a few hours before drinking.",Sierra Madre Vineyard,90,48.0,California,Santa Barbara County,Central Coast,Pinot Noir,La Montagne
US,"The winery's top cuvée is notable for its perfume of rose petals with a subtle whiff of body talc. Balanced and feminine, this soft and graceful wine glides across the palate with flavor highlights of cherries and plums. Drink now while it's at its best.",Lachini Family Estate,90,48.0,Oregon,Chehalem Mountains,Willamette Valley,Pinot Noir,Lachini
US,"Dryness, acidity and minerality mark this Chardonnay. It's elegant, with Meyer lemon, lime and new French oak flavors that bring a rich note of buttered toast. The score is lifted by the wine's balance. Drink now–2018.",Estate 25th Anniversary,90,28.0,California,Santa Lucia Highlands,Central Coast,Chardonnay,McIntyre Vineyards
US,"The Napa-ness of this Pinot makes it so interesting. Grown in a warmer climate, it's dry, soft and somewhat herbal, with red currant, cola, tea, cranberry and mushroom notes. It feels complex in the mouth, without the flash and dazzle of more coastal bottlings, but there's a lot going on. Drink now–2017.",,90,44.0,California,Napa Valley,Napa,Pinot Noir,Brick & Mortar
US,"It takes a certain trust in the ageability of a young Calera Pinot Noir to appreciate it, as evidenced by this bottling. It's dry and tannic, with acid-inflected raspberry jam and oak flavors that show little in the way of complexity. Yet there are earthy, herbal, minerally depths. Granted that the vintage was difficult, this still is a wine to age. Try after 2017.",Reed Vineyard,90,60.0,California,Mt. Harlan,Central Coast,Pinot Noir,Calera
Italy,"Bright and delicious, this starts with aromas of blue flower, red berries, mint and thyme together with a whiff of leather. The juicy palate offers wild cherry and strawberry accented with cinnamon-spice alongside fresh acidity and firm but fine tannins. Drink now through 2016 to capture the fresh, crunchy berry character.",,90,16.0,Tuscany,Chianti Classico,,Red Blend,Castellinuzza e Piuca
France,"This firm and structured wine also has full-on ripe, jammy fruits. The combination gives weight, richness and structure. A touch of licorice adds an extra dimension to this fruity, firm wine. Drink from 2017.",La Chêneraie,90,55.0,Bordeaux,Fronsac,,Bordeaux-style Red Blend,Château Jeandeman
France,"In this complex wine, surface fruitiness doesn't mask the firm layers of tannins that give shape and density. It's full of black plum flavors that show a juicy side to what is also a wine for long-term aging. Drink from 2018.",,90,20.0,Bordeaux,Haut-Médoc,,Bordeaux-style Red Blend,Château Paloumey
France,"A mix of ripe black fruits and dense tannins characterize this young wine. Its structure is surrounded by rich fruits, smoothly textured and generous. Acidity gives the wine a fresh touch in its aftertaste. Drink from 2016.",,90,45.0,Bordeaux,Saint-Émilion,,Bordeaux-style Red Blend,Château Tour de Pressac
US,"This 100% Cabernet deserves its reserve status. Compared to the regular 2011, it's richer, with a smoothly tannic mouthfeel framing blackberry, black currant and cedar flavors. It will hold in the bottle until 2018, but there's no reason not to pop the cork now.",Reserve,90,50.0,California,Napa Valley,Napa,Cabernet Sauvignon,Triumph Cellars
US,"Dark in color and deeply flavored, as the name suggests, this blend has evocative blackberry, currant, grilled meat, black pepper and oak flavors. It's also tannic, suggesting cellaring until 2019.",Dark & Brooding,90,54.0,California,Sonoma County,Sonoma,Red Blend,Palmeri
US,"The acidity is like a double squeeze of lime juice. It gets the tastebuds whistling, which allowss the intense lemon, lime and mango flavors to spread across the mouth and sink deep into the palate. This zesty wine needs rich fare. Ahi tuna tartare is perfect.",Bald Mountain Vineyard,90,45.0,California,Ben Lomond Mountain,Central Coast,Chardonnay,Beauregard
US,"Delicious fruit aromas and flavors define this medium bodied and very smooth blend that is 50% Graciano grapes. Aromas convey floral notes, strawberries and oranges, while the flavors bring more strawberries and cherries. The texture is not light but the wine is still extremely easy to sip.",,88,50.0,California,Sierra Foothills,Sierra Foothills,Red Blend,La Folia Winery
US,"From a hilltop location near the ocean-influenced town of Freestone, this wine is silky in plum and dark cherry, a hint of mushroomed earth doing its best to come out. Robust on the palate, juicy berry fruit satisfies, finishing thick and rich.",Rayhill Vineyard,88,60.0,California,Sonoma Coast,Sonoma,Pinot Noir,Landmark
US,"A tremendous value, this white is light and floral, soft in honeyed stone fruit and pineapple. A nice minerality buoys the proceedings, a medium-body taking on new strength midway through before letting the wine finish crisp and clean.",,88,15.0,California,Sonoma County,Sonoma,Chardonnay,St. Francis
Italy,"Aromas of underbrush, blue flowers, cooking spice and black plum unfold in the glass. A blend of 50% Sangiovese and 50% Malvasia Nera, the palate reveals dried black cherry, black pepper and anise alongside firm, polished tannins. Drink through 2017.",Maurleo,88,19.0,Tuscany,Toscana,,Red Blend,Pietro Beconcini
Italy,"A blend of 60% Merlot and 40% Cabernet Sauvignon, this sleek wine opens with aromas of red currant, bell pepper and herbs. On the juicy palate, notes of white pepper and clove add interest to crushed strawberry and cassis. Tangy acidity and polished tannins provide the framework.",Lippo,88,28.0,Tuscany,Toscana,,Red Blend,Pieve Santo Stefano
Chile,"This opens with damp, rubbery plum aromas. The palate is spunky and offers live-wire acidity, with cherry, raspberry, toast and pepper flavors balancing it out. Speckled black pepper comes on the dry finish.",Q Grand Reserve,88,20.0,Casablanca Valley,,,Pinot Noir,Quintay
France,"While the wine has some concentration from the old vines, its general effect is of a soft, open and generous texture that is full and rounded. There is some spice, a touch of toast and full-bodied blackberry and currant flavors. Drink now.",Baron d'Ardeuil Vieilles Vignes,88,15.0,Southwest France,Buzet,,Bordeaux-style Red Blend,Vignerons de Buzet
US,"Bruised apricot, lemonade and citrus rind-laden marzipan notes hit the nose on this wine, which is showing just a touch of nutty, honeyed oxidization. The macadamia nut element arises on the palate too, alongside intriguingly peaty flavors reminiscent of Scotch, with almond liqueur on the outro. It presents decent acidity throughout.",Reserve,88,35.0,California,Santa Cruz Mountains,Central Coast,Chardonnay,Wrights Station
France,"This is a dark and concentrated wine, solid with dark plum skin tannins and a dense structure. A fresher side brings in spice and a tense texture of both freshness and acidity. It should age a couple of years more, so drink from 2017. The estate, about 31 miles from Toulouse along the Tarn river, has a well-recorded history of family ownership over many centuries and is now run by the Faramond family.",,88,12.0,Southwest France,Gaillac,,Red Blend,Château Lastours
France,"This rich, full-bodied wine is packed with ripe, dense blackberry and plum flavors. With firm tannins in the background, it is always going to be dark and solid. Produced on a single vineyard by the local cooperative, it could still age and will be best from 2016.",Château Bazin,88,45.0,Southwest France,Côtes du Marmandais,,Red Blend,Cave du Marmandais
Chile,"Aromas of brambly plum and raspberry set up a palate with ripe flavors of black cherry and nutmeg. A baking-spice character carries onto the finish, which turns more soft and candied as it wraps up.",Gran Reserva Estate Bottled,88,20.0,Casablanca Valley,,,Pinot Noir,Casas del Bosque
Italy,"A blend of Cabernet Sauvignon, Sangiovese, Merlot and Syrah, this opens with aromas of black currant, pencil shavings, toast and a whiff of pine. Notes of mocha, graphite and anise add depth to the black cherry core alongside chewy but astringent tannins that leave a drying finish. Drink 2016–2018.",Non Confonditur,88,26.0,Tuscany,Toscana,,Red Blend,Argiano
US,"Black pepper, anise, boysenberry and a bit of juniper combine for a slightly funky, somewhat reductive nose on this blend of 46% Grenache, 23% Petite Sirah, 23% Syrah, 6% Carignane and 2% Mourvèdre. There's an ample amount of blackberry jam and chopped Italian herbs on the palate, with an asphalt character in the midpalate and a somewhat tart finish.",Hope,88,40.0,California,California,California Other,Red Blend,Aver Family Vineyards
US,"Licorice and blackberry scents float off the surface of this estate wine. Once sipped, a thinner juiciness takes hold, with boysenberry and cracked pepper leading the way.",,88,26.0,California,Paso Robles,Central Coast,Cabernet Sauvignon,Still Waters
US,"Elegant and compact, it offers appealing flavors that call to mind a cherry popsickle—fruity, with palate-cleansing freshness. The wine does a gentle fade, perhaps more quickly than you'd wish.",Alloro Vineyard,88,60.0,Oregon,Chehalem Mountains,Willamette Valley,Pinot Noir,Torii Mor
US,"Hanzell took on a new barrel regime with the 2011 vintage, opening the door to several different coopers to taste over time. Additionally in 2011, the Pinot grapes came from both the Sessions and de Brye vineyards. The wine is marked by a bouquet of baked strawberry and cherry, the layers interwoven in oak and dust.",,88,98.0,California,Sonoma Valley,Sonoma,Pinot Noir,Hanzell
France,"A concentrated wine, it's packed with both dark fruits and tannins. A dense structure contrasts with the fresher black currant fruitiness. Ripe and full-bodied, the wine needs to age. Drink from 2016.",,88,21.0,Bordeaux,Côtes de Bourg,,Bordeaux-style Red Blend,Château Métairie Neuve
US,"There's a burly amount of black fruit and black tea in this estate wine, concentrated and coiled in a tight tannic structure. The fruit tends toward ripe black cherry and even blackberry, the texture is soft and the finish delightfully marked by a touch of chocolate.",Sexton Hill Vineyard,88,42.0,California,Russian River Valley,Sonoma,Pinot Noir,Balletto
Spain,"Floral, stony red-fruit aromas are the right set up for a tight, almost citric feeling palate. Flavors of cherry and red plum are narrow and quick-hitting, while the finish is bright, juicy and runs on acidity. This demands food; it's raw by itself.",AV14 Clos d'Englora,88,30.0,Catalonia,Montsant,,Red Blend,Cellers Baronia del Montsant
France,"Crisp and young, this wine, from 50-year-old vines, is tangy and strongly mineral in texture. It is full of fresh fruit that reflects the of organic and biodynamic farming. The green fruits will fill out as it ages. Drink from 2017.",Maison du Villard,90,35.0,Burgundy,Pouilly-Fuissé,,Chardonnay,Château de Lavernette
US,"Dark in color, this bold, full-bodied wine is succulent and rich in blackberry and black cherry, with a dusting of cranberry and grilled mushroom. There's a balance of acid and tannin that provides substance and structure, with length on the finish.",,90,40.0,California,Sonoma Coast,Sonoma,Pinot Noir,MacPhail
US,"Quite buttery and nutty on the nose, this wine shows Marcona almonds, seared pineapple, crème brûlée and vanilla custard. Those elements meet with smart amounts of acid and texture on each creamy, buttery, pineapple-laced sip, which then finishes on marshmallow flavors.",Reserve,90,35.0,California,Edna Valley,Central Coast,Chardonnay,Edna Valley Vineyard
