country,description,designation,points,price,province,region_1,region_2,variety,winery
US,"Creamy on the nose, this wine shows seared pineapple, apple custard, lemon oil and faint iodine aromas. The flavors are evenly placed between lemon yogurt and salted apples, mixing a bit of tang and ripe fruit with a savory sea salt.",Rosella's Vineyard,91,40.0,California,Santa Lucia Highlands,Central Coast,Chardonnay,Bernardus
US,"Lush aromatics conjure up dreams of strawberry cream. This is quite pretty, with perfect balance among its components of fruit, acid and tannin, set comfortably in a compact frame.",,91,42.0,Oregon,Willamette Valley,Willamette Valley,Pinot Noir,Big Table Farm
US,"Cedar, cherry, black olive, wet earth, green olive and freshly plucked plum pop on the nose of this bottling. The palate shows lots of ripe black cherry down the middle, but is surrounded by a tangy green olive and an underripe-berry character, whose tartness enlivens the mouth.",Cuore della Vigne,90,41.0,California,Paso Robles,Central Coast,Red Blend,Le Vigne
France,"The Pinot-ness of this wine is undeniable: its structure is of velvet, and its aromas convey freshly turned earth, autumnal oak leaf and subdued red-cherry fruit. There is a depth that evokes deep forests. Have this with furred or feathered game.",Galets Oligocène,90,33.0,Alsace,Alsace,,Pinot Noir,Domaine Bott-Geyl
France,"This is a blend from most parts of the village, with fruit from 14 different parcels. It is solid and firm while also having great swathes of raspberries and red plums laced together with acidity. The aftertaste is perfumed with a fresh lift. Drink from 2018",,90,70.0,Burgundy,Gevrey-Chambertin,,Pinot Noir,Domaine Faiveley
US,This new sister label from Elk Cove offers 100% Willamette Valley Pinot Noir at an everyday price. Fresh cranberry and raspberry fruit is framed by herb-tinged tannins. The immaculate craftsmanship and clean direct flavors are light years beyond budget Pinot Noir from most other regions. This is your perfect salmon wine.,,90,19.0,Oregon,Willamette Valley,Willamette Valley,Pinot Noir,Pike Road
US,"Planted with eight grapes, including the three Pinot “sisters”—Blanc, Gris and Noir—this site is located just below Archery Summit in the heart of the Dundee Hills. The pale, pretty rosé hue introduces this most elegant and restrained of the winery's vineyard selections. It's a velvety, finesse wine, with delicate flavors of rhubarb, cinnamon, cardamom and cocoa.",Sisters Estate,90,45.0,Oregon,Dundee Hills,Willamette Valley,Pinot Noir,The Eyrie Vineyards
France,"With some firm structure, this wine also has great fruitiness. It offers plenty of raspberry fruits, good acidity and a solid texture of tannins. The acidity keeps the wine perfumed and fresh. Drink the wine from 2019.",Domaine du Pavillon Clos des Ursulines,90,80.0,Burgundy,Pommard,,Pinot Noir,Albert Bichot
US,"A slightly herbal, minty character gives personality to this full-bodied, generous and richly textured wine. It is attractively dry, nicely tannic, layered with black cherry, wild berry and rosemary notes. Great to drink now through 2020 with rich meats or mushrooms.",,90,15.0,California,California,California Other,Cabernet Sauvignon,Hahn
US,"An ambitious, concentrated, but not oaky wine, this has a very dark color, aromas of black cherries, and ripe but dry flavors of blackberries and dark chocolate. It is medium to full bodied, framed by lots of fine-grained tannins and finishing with more dark fruit. It's a good wine to lay down and drink after 2019.",,90,15.0,California,North Coast,North Coast,Cabernet Sauvignon,Lyeth
US,"From a valley-floor site, this blend of 70% Zinfandel and 30% Cabernet Sauvignon delights in a depth of blackberry and cedar, reflecting well on both varieties. Firm tannin and restrained oak provide room for a touch of gun smoke and pencil lead, with a lengthy finish.",Rector Creek Vineyard,90,80.0,California,Napa Valley,Napa,Red Blend,Paraduxx
US,"From several vineyard sites and combining all five red Bordeaux varieties, this wine is fermented in stainless steel before it rests over two years in both French and American oak. Powerful, it retains an elegance amid a tannic, grippy entry of toasted oak and black cherry, and a rich textured finish accented in cinnamon and chocolate.",,90,50.0,California,Napa Valley,Napa,Cabernet Sauvignon,Freemark Abbey
US,"Grippy leather and tobacco provide a gravelly texture and burly nature to this medium-bodied wine, which finds its groove in the glass. Concentrated and dense, it offers smoother elements of black currant, cassis and leather on the finish.",Olson Vineyard,90,28.0,California,Dry Creek Valley,Sonoma,Cabernet Sauvignon,Joleté
US,"Seductive, spicy oak in the aromas and flavors puts a great spin on this medium-bodied, velvety smooth wine from a promising new winery in Northern California. Some ripe black-cherry and cranberry flavors chime in as well, supporting the toasted baguette, cedar and nutmeg nuances and layering seamlessly.",,90,40.0,California,Red Hills Lake County,Mendocino/Lake Counties,Cabernet Sauvignon,Boatique
US,"This is the Hearst family's run at a luxury-level Chardonnay, and it's a promising start, with creamy aromas of honeysuckle, light butter and citrus rinds. There's a touch of vanilla bean on the palate, which also shows apple ice cream, flashes of cinnamon and a firmly wound texture. It's delicate, clean, light and quaffable.",Proprietor's Reserve,90,50.0,California,Central Coast,Central Coast,Chardonnay,Hearst Ranch
US,"Juicy blackberry and blackcurrant mix with cocoa, cola and peppercorns on the nose of this densely layered wine. Flavors are deep and dark with tar, pencil shavings, dried blueberry, street asphalt and a strong umami character, still tightly wound at five years old. Let it breathe, or wait another couple years for optimal drinking.",Cabovation Destiny Vineyards Mt. Christo Block Reserve,90,75.0,California,Paso Robles,Central Coast,Cabernet Sauvignon,Hunt Cellars
Canada,"This Bordeaux-style blend is comprised of 44% Cabernet Sauvignon, 43% Merlot and 13% Cabernet Franc. The fruit flavors of raspberry and blackberry are light and tangy, the tannins mellow. A note of dark chocolate highlights the finish.",Compendium,90,70.0,British Columbia,Okanagan Valley,,Bordeaux-style Red Blend,Mission Hill
France,"This is a finely perfumed wine, rich in both structure and ripe fruits. It is smoothly textured, a full-bodied wine that has dark cherry flavors as well as a balanced layer of acidity. The wine is still young, juicy and will develop further, so drink from 2017.",Terre de Maimbray,90,,Loire Valley,Sancerre,,Pinot Noir,Pascal & Nicolas Reverdy
US,"Malbec, Merlot and Petit Verdot are included in this wine that's black-purple in color, with a thick density to its dusty black fruit. Cedar, tar and tobacco weave in between blackberry and currant, finishing in a powerful grip of tannin.",Kate's + B's,90,75.0,California,Alexander Valley,Sonoma,Cabernet Sauvignon,Medlock Ames
US,"Grapes are sourced from both Stagecoach and Hyde vineyards in this wine that takes its time in the glass coming around. Funky brine and a tropical flourish open on the nose with a severity of oak that mellows slowly. Made in an opulent, full-bodied style, it'll pair well with buttery fare.",,90,60.0,California,Napa Valley,Napa,Chardonnay,Patland
US,"Tropical guava and mango surround a restrained cradling of French oak, only 15% of it new, in this easy-to-like, approachable wine. Wrappings of vanilla and honeysuckle complete the picture, with a straightforward, relatively lengthy finish.",Signpost,90,22.0,California,Sonoma Coast,Sonoma,Chardonnay,Trig Point
US,"Caramelized oak makes a statement in this wine that starts out richly and roundly, but finds a sense of balanced acidity in the glass. Medium bodied, it features classic notes of Meyer lemon and Gravenstein apple.",,90,30.0,California,Russian River Valley,Sonoma,Chardonnay,Terlato
US,"This straightforward wine shows an exuberance of toasted oak and grip at first before relaxing into its more mannered self, a twist of cedar and sage giving it a classic sensibility. Cassis and black cherry take on more power on the full-bodied palate, exhibiting the soft approachability of the appellation.",,90,35.0,California,Alexander Valley,Sonoma,Cabernet Sauvignon,The Calling
Italy,"Forest floor, black plum, menthol and a whiff of exotic spice unfold on this elegantly structured wine. The precise palate offers mature black cherry, ground pepper, licorice and hint of chewing tobacco framed in firm, fine-grained tannins. Drink through 2019.",,90,32.0,Tuscany,Vino Nobile di Montepulciano,,Red Blend,Cecchi
US,"Though just four years old, this wine seems advanced with notes of dried cherry, vanilla, dried tobacco and blackberry. The dried cranberry and cherry flavors are rich and tart, backed by quite astringent tannins.",,87,36.0,Washington,Columbia Valley (WA),Columbia Valley,Cabernet Sauvignon,Dussek Family Cellars
France,"This wood-aged wine conveys mint aromas and new-wood flavors. It is rich, full in the mouth and developing quickly. The black currant fruitiness is fresh, giving a delicious, juicy wine to drink from 2016.",Cuvée Lucie,87,,Bordeaux,Médoc,,Bordeaux-style Red Blend,Les Hauts de Tousquiron
US,"This presents a big, buttery, bold style, with no apologies for the full body and ripe fruit surrounded by toasty, oaky aromas and flavors. This is dry, rich in texture, and more savory or smoky rather than fruity.",Chandler Vineyard,87,30.0,California,Livermore Valley,Central Coast,Chardonnay,McGrail
US,"Heavy aromas and flavors of oak and smoke accompany ripe black cherry and boysenberry for a rich mixture. This wine is deeply colored, full bodied and pumped up with the flavors of heavily toasted oak. A firm but not harsh texture accompanies the almost sweet taste of all that oak.",Freakshow,87,20.0,California,Lodi,Central Valley,Cabernet Sauvignon,Michael David
US,"This wine offers notes of Red Hots, coffee, vanilla and herbs. Cherry and blackberry flavors are sweet and viscous in feel backed by dry tannins.",Reserve,87,23.0,Idaho,,,Cabernet Sauvignon,3 Horse Ranch Vineyards
US,"The nose on this wine from American Idol producers Nigel Lythgoe and Ken Warwick is a bit reluctant to show itself at first, then lets go of rounded red and purple fruits, with freshly turned soil and dust. Ripe black cherries and tart plum skins mix on the earthy palate, and the tannins will unfurl with more time.",,87,20.0,California,Paso Robles,Central Coast,Cabernet Sauvignon,Villa San Juliette
US,"This well-made, stainless-steel-fermented and aged Chardonnay offers notes of red apple and spice. It's straightforward and provides pleasant, easy drinking.",Unoaked,87,22.0,Idaho,,,Chardonnay,Hat Ranch
Italy,"A blend of 70% Cabernet Sauvignon and 30% Merlot, this wine features earthy aromas of leafy forest floor, tilled soil and dried black currant. The straightforward palate delivers juicy blackberry, raspberry and clove alongside smooth tannins. Drink through 2016.",Scirè,87,17.0,Tuscany,Bolgheri,,Red Blend,Ceralti
Spain,"Berry and cherry aromas are fruity and clean. This blend of Carignan, Grenache and Syrah is big on the palate but also tannic, acidic and fierce. Black plum, blackberry and tomato flavors finish crisp and firm.",Brunus,87,28.0,Catalonia,Montsant,,Red Blend,Portal del Montsant
US,"From an estate vineyard, this wine is robust, full-bodied and viscous, with an underlying hint of petrol and plenty of oak. There's a tartness behind its flavors that gives it a lift as it finds its way to the finish.",Cannon Block,86,26.0,California,Knights Valley,Sonoma,Chardonnay,Lawer
US,"This 100% varietal wine is aged in American oak, offering an approachable, rounded, full-bodied impression of pencil shavings, cherry, leather and tobacco bound by firm tannins.",Porter and Plot,86,31.0,California,Napa Valley,Napa,Cabernet Sauvignon,Winc
US,"A substantial dose of fruit and good, grippy texture make this hearty wine ready for any protein dishes. It has full body, tasty black cherry and plum flavors and moderate tannins that lend structure.",Reserve,86,18.0,California,Mendocino County,Mendocino/Lake Counties,Pinot Noir,Angeline
US,"This bottling is ripe and tropical but approachable on the nose, with honeydew melon, banana and nectarine aromas. There is a decent punch of acidity and noticeable texture upon first sip, veering toward sweet apple and bubblegum flavors on the finish.",Estate Vineyard,86,24.0,California,Paso Robles,Central Coast,Chardonnay,Eberle
US,"This straightforward, affordable dry wine is good and fruity, with medium body, moderate tannins and plenty of red cherry and blackberry flavors.",,86,12.0,California,California,California Other,Pinot Noir,Guenoc
US,"The nose of this blend of 58% Syrah, 17% Cabernet Franc, 9% Merlot, 8% Malbec and 8% Petite Sirah is a touch funky, with sour blackberry, charcoal and dried meat aromas. Charred blueberry, sour black plum and savory meat flavors show on the palate.",The Deep Six,86,32.0,California,South Coast,South Coast,Red Blend,Hawk Watch Winery
US,"Made from what Californians call the Pommard clone, this has a light, traditional garnet color. Fresh and lively fruit aromas resemble cranberries and red cherries, followed by tangy fruit and cinnamon flavors of medium intensity, supported by firm acidity and moderate tannins.",Charles Vineyard Clone O5,89,49.0,California,Anderson Valley,Mendocino/Lake Counties,Pinot Noir,Foursight
France,"This blend of local Duras and Braucol with the more Mediterranean Syrah is attractively spicy and juicy. It is packed with red fruits, sweet berry flavors and ripe tannins. The wine is maturing well and will be ready to drink from 2016.",Les Gravels,89,19.0,Southwest France,Gaillac,,Red Blend,Domaine Rotier
US,"This is full bodied and forward, bringing a generous mouthful of apple, pear and pineapple fruit along with a streak of vanilla wafer. The flavors hit quickly and right up front, then suspend themselves through a lingering finish.",,89,35.0,Oregon,Willamette Valley,Willamette Valley,Chardonnay,Aubichon Cellars
US,"Bloody meats, dried cherries, pressed purple flowers, vanilla and blackberry jam arise on the nose of this blend of 60% Cabernet Sauvignon, 33% Cabernet Franc and 7% Merlot, which shows a little age. The purple flowers really come through once sipped, backed up by sour cherries, mocha and sanguine elements, cast across grippy tannins.",Cheval Rouge Reserve,89,30.0,California,Carmel Valley,Central Coast,Bordeaux-style Red Blend,Boëté
Italy,"Made with Cabernet Sauvignon, this opens with aromas of toast, coffee, black currants and a whiff of cedar. The palate delivers dried black cherries, espresso, grilled sage and a leathery note alongside assertive, astringent tannins.",Coniale,89,55.0,Tuscany,Toscana,,Cabernet Sauvignon,Castellare di Castellina
US,"The estate reserve gets more new and once-filled oak, and is a selection from vines whose yield has been dropped to 1.5 tons/acre. It's forward and flavorful, with black cherry, coffee and anise components. The entry is smooth and continues so, on through a finish complete with sandalwood and butterscotch.",Nicholas Estate Reserve,89,46.0,Oregon,Chehalem Mountains,Willamette Valley,Pinot Noir,Anam Cara
US,"This firm, well-crafted wine reflects the lightness of the vintage. Raspberry, citrus and stone components come across in a balanced effort that should continue to drink well until 2020.",,89,50.0,Oregon,Willamette Valley,Willamette Valley,Pinot Noir,Carden
US,"Warm berry-rhubarb pie notes mix with black pepper and an appealing, shy layer of green bell pepper on this blend of 50% Merlot, 28% Cabernet Sauvignon, 20% Cabernet Franc and 2% Petit Verdot from three vineyards. Stewed plums, cherries and strawberries dominate the tasty palate, with a proper acidity and woody bitterness as balance.",Fourplay,89,43.0,California,Santa Ynez Valley,Central Coast,Red Blend,Carhartt Vineyard
Italy,"This blend of 80% Cabernet Sauvignon and 20% Sangiovese opens with aromas of crushed blackberry, ripe plum and blue flowers. On the palate, notes of anise and black pepper accent the core of fleshy black cherry while assertive but polished tannins provide the framework. Drink through 2016–2019.",Daniello,89,30.0,Tuscany,Toscana,,Red Blend,Tenuta di Trecciano
Italy,"This brooding wine opens with aromas of mature blue and black fruit, allspice, charred earth and whiff of game. The palate delivers spiced blueberry, blackberry, ground pepper, licorice and tobacco alongside assertive tannins.",Il Tarabuso,89,45.0,Tuscany,Toscana,,Cabernet Sauvignon,Terre del Marchesato
Spain,"Earthy berry and licorice aromas are composed, lightly oaked and attractive. This standard Priorato blend of Grenache, Carignan and Syrah is fresh feeling, with a bolt of bracing acidity. Juicy plum and raspberry flavors finish loamy, earthy and balanced. For a wine that's no heavyweight, this is strong throughout. Drink through 2018.",,89,23.0,Catalonia,Priorat,,Red Blend,Vega Escal
Chile,"Blackberry, cassis, herb and spice aromas are complete and ripe. This Cabernet-led blend is focused and direct on the palate, with berry, cassis, chocolate and oaky flavors. A similar tasting finish, with additional chocolate and creamy oak is weighty and pleasing.",Fina Reserva Ensamblaje Cabernet Sauvignon-Malbec-Syrah,89,19.0,Colchagua Valley,,,Red Blend,Estampa
US,"Fruit from the Momtazi vineyard often has a strong herbal component, here matched to a tart cranberry base. This wine is young, tight, and slightly bitter in the finish, with a hint of pineapple in the acidity. Overall the winemaker's elegant hand lightens up the aggressive herbaceousness, but a bit more fruit would be welcome.",Momtazi Vineyard,89,44.0,Oregon,McMinnville,Willamette Valley,Pinot Noir,Kelley Fox
Italy,"This blend of Cabernet Sauvignon, Cabernet Franc and Merlot opens with aromas of bluish-black fruit, toasted oak, espresso and licorice. The palate delivers blackberry extract, anise, clove and tobacco while dusty tannins provide support.",Carmione,89,30.0,Tuscany,Toscana,,Red Blend,Pratesi
US,"This is an excellent Chardonnay for an accessible price. It's balanced and textured, with bites of apple and anise highlighting the journey. Power and finesse are offered in equal measure. A delicious wine for the table, it will impress with its depth and complexity.",Dutton Ranch Mill Station Vineyard,92,30.0,California,Green Valley,Sonoma,Chardonnay,Martin Ray
US,"Muted black plum teases from the nose of this wine, a blend of 73% Cabernet Sauvignon, 16% Merlot, 8% Cabernet Franc and 3% Petit Verdot. Amidst a wall of dusty tannins still needing time to soften, you'll find clove, blackberry and a treasure trove of chocolate and vanilla.",Cambium,92,125.0,California,Napa Valley,Napa,Bordeaux-style Red Blend,Sequoia Grove
US,"From a single-vineyard, estate-grown and bottled, this is an intense 100% Cabernet, generous in roasted plum, cedar and coffee. With supple tannins it's easy to enjoy, concentrated and dark, a good match for roasted meats and savory pies.",,92,98.0,California,Atlas Peak,Napa,Cabernet Sauvignon,VinRoc
US,"Black Eyed Peas singer Fergie and Winemaker Joey Tensley converge on a blend of Syrah, Merlot, Grenache and Cabernet Sauvignon that's worth sitting on until at least 2019. Woody, cigar box aromas pick up notes of camphor and flashes of red fruit, and the flavors fall in line around the cedar, with blueberry, black cherry and milk chocolate.",Fergalicious,92,40.0,California,Santa Ynez Valley,Central Coast,Red Blend,Ferguson Crest
US,"Working from an urban winery on Santa Barbara's Eastside, Matthias Pippig created the Loner Chardonnay series. This entry begins with scents of cider, nectarine and lemon-lime soda before delving into a palate laden with yellow fruits and flowers. Sourdough yeastiness surrounds a lingering line of grapefruit zest-led acidity.",Loner W11-B,92,60.0,California,Santa Maria Valley,Central Coast,Chardonnay,Sanguis
US,"With voluptuous confectionary-like aromas surrounded by a rich toasty character, this wine from the wonderful Hyde Vineyard offers lemon and crisp yellow apple around a core of brilliant minerality. Vanilla and crème brûlée interplay on the palate, the body of the wine firm and round.",Hyde Vineyard,92,68.0,California,Carneros,Napa-Sonoma,Chardonnay,Ram's Gate
US,"Big points for subtlety, length and elegance here—this is not a wine that will blow you away at first sniff. Stay with it and it stays with you; opening sharp-edged, pungent and slightly grassy, then developing a tightly focused midpalate with pure lime and apple fruit flavors. Accents of mustard greens and white pepper come in as a long, delicate yet detailed finish slowly unfolds.",Conner Lee,92,32.0,Washington,Columbia Valley (WA),Columbia Valley,Chardonnay,Array
US,"This single-vineyard wine shows both the warmth of the vintage and the coolness of this site, boasting depth and richness to the fruit flavors while retaining good acidity. It combines notes of apple, peach and lees with light barrel accents—20% new French—and a creamy feel. Enjoy with shrimp stir fried in olive oil for a pairing nirvana.",Celilo Vineyard,92,66.0,Washington,Columbia Gorge (WA),Washington Other,Chardonnay,Woodward Canyon
US,"This begins with scents of dried orange rinds and mango laced with honey as well as deeper aromas of rocks and savory herbs. A tight lemon acidity runs down the middle of the palate, with yellow flowers, yeast and toasted pine nuts on the side. It's both racy and rounded, and is showing a touch of age.",Melville Vineyard,92,32.0,California,Sta. Rita Hills,Central Coast,Chardonnay,Lafond
US,"Honeysuckle and jasmine pique interest aromatically before luscious, linear waves of vanilla, caramel and lemon custard graciously interject, buoyed by ample acidity and a lush texture. This Chardonnay offers generous richness alongside high-toned minerality, and is a delicious go-to for buttery lobster dishes.",Quail Hill Vineyard,92,55.0,California,Russian River Valley,Sonoma,Chardonnay,Lynmar
France,"This special selection, tight-cropped from 30 acres of 100% Merlot, is ripe and rich. This is a smoky and fruity wine, in barrel for 14 months. It has ripe black fruits and rich, dense structure. Spice and toast balance the fruit, giving an impressive sense of generosity. Drink from 2017.",,92,18.0,Bordeaux,Blaye Côtes de Bordeaux,,Bordeaux-style Red Blend,Château Marsau
US,"The aromas of this Chardonnay are zesty and fresh yet rich, with barrel smoke, caramelized pear and vanilla tones. The integration continues on the palate, with a bit of oak followed by apple, white peach, nectarine and lime zest. It's flavorful and enjoyable now.",Nielson Vineyard,92,32.0,California,Santa Maria Valley,Central Coast,Chardonnay,Byron
Chile,"Deep, pure cassis and red berry aromas are integrated and thorough. This Bordeaux-style blend of Cabernet Sauvignon, Petit Verdot, Cabernet Franc and Merlot is racy, tight and hard-driving, with bold berry, pepper, baking spice and chocolate flavors. A toasty, peppery finish is juicy, forward and long. Drink through 2020.",Edición Limitada B,92,30.0,Colchagua Valley,,,Bordeaux-style Red Blend,Caliterra
US,"Unctuous and ripe in caramel and toasty aromas, this is deep golden in color but completely crisp and balanced in the glass. The nose is so overwhelming that the flavors take time to show. Once they do, it's a celebration of green apple and melon enveloped in complex minerality and a supple body.",Fort Ross Vineyard,92,44.0,California,Fort Ross-Seaview,Sonoma,Chardonnay,Fort Ross
France,"Situated close to the northern edge of Beaune vineyards, this premier cru has something of the soft ripeness of Savigny-lès-Beaune next door. The wine is ripe, with tannins that are present although certainly not dominant. It has the potential to revel in its red fruits and generous texture. Drink this wine from 2019.",Les Marconnets Premier Cru,90,50.0,Burgundy,Beaune,,Pinot Noir,Labouré-Roi
France,"This structured wine still has wood aromas although on the palate the rich, dark fruits dominate. The tannins both from wood and from the fruit are firm and still young, showing the possibility of long-term aging. This complex wine should not be drunk before 2019.",,90,45.0,Burgundy,Morey-Saint-Denis,,Pinot Noir,Labouré-Roi
US,"Quite a steal of a deal for a widely available wine, this shows cinnamon, red cherry, ripe cranberry, light tobacco and a touch of leather on the rustic nose. Once sipped, the mouthfeel is soft, offering flavors of cranberry and red cherry that are spiced by thyme, bay leaf and more cinnamon.",Estate Vineyards,90,23.0,California,Central Coast,Central Coast,Pinot Noir,MacMurray Ranch
US,"Hazelnut and truffle compete for affection in this juicy, rounded, lovable wine, a full-bodied and structured example from the appellation, known for its at-times generous portrait of tannin and wound-up concentration.",Sundawg Ridge Vineyard,90,49.0,California,Green Valley,Sonoma,Pinot Noir,MacPhail
France,"Aromas of this wine show considerable wood. On the palate, the wood is very present, giving acidity as well as layers of toast and spice. Hints of yellow fruit show through, suggesting the possibility of a ripe, rich wine in the future. Drink from 2019.",Bastion Premier Cru,90,59.0,Burgundy,Beaune,,Chardonnay,Chanson Père et Fils
France,"With tannins and new-wood flavors, this rich wine is also structured. A smoky character from the wood is shot through by perfumed red fruits. The aftertaste shows more of the wood flavors that need to integrate. Drink from 2018.",Clos de Jeu,90,,Burgundy,Marsannay,,Pinot Noir,Domaine Collotte
